group_id,group_title,lesson,question_no,question_jp,meaning_vi,option_a,option_b,option_c,option_d
4,Câu đồng nghĩa,JLPT N5 20107,1,【まいばん くにの かぞくに でんわします。】,Mỗi tối tôi gọi điện cho gia đình ở quê.,よるは ときどき くにの かぞくに でんわします。,あさは ときどき くにの かぞくに でんわします。,よるは いつも くにの かぞくに でんわします。,あさは いつも くにの かぞくに でんわします。
4,Câu đồng nghĩa,JLPT N5 20107,2,【このまちには ゆうめいな たてものが あります。】,Ở thành phố này có tòa nhà nổi tiếng.,このまちには ゆうめいな ビルが あります。,このまちには ゆうめいな おちゃが あります。,このまちには ゆうめいな ケーキが あります。,このまちには ゆうめいな こうえんが あります。
4,Câu đồng nghĩa,JLPT N5 20107,3,【その えいがは おもしろくなかったです。】,Bộ phim đó đã không thú vị.,その えいがは たのしかったです。,その えいがは つまらなかったです。,その えいがは みじかかったです。,その えいがは ながかったです。
4,Câu đồng nghĩa,JLPT N5 20107,4,【たんじょうびは 6がつ15にちです。】,Sinh nhật là ngày 15 tháng 6.,6がつ15にちに けっこんしました。,6がつ15にちに テストが はじまりました。,6がつ15にちに うまれました。,6がつ15にちに くにへ かえりました。
4,Câu đồng nghĩa,JLPT N5 20107,5,【にねんまえに きょうとへ いきました。】,Tôi đã đi Kyoto 2 năm trước.,きのう きょうとへ いきました。,おととい きょうとへ いきました。,きょねん きょうとへ いきました。,おととし きょうとへ いきました。
