group_id,group_title,lesson,question_no,question_jp,romaji,meaning_vi,option_a,option_b,option_c,option_d
6,Thể ない,Mina bài 17,43,ここで写真を撮ら＿＿ください。,Koko de shashin o tora ___ kudasai.,Xin đừng chụp ảnh ở đây.,ないで,なければ,なくても,ません
6,Thể ない,Mina bài 17,44,宿題をし＿＿なりません。,Shukudai o shi ___ narimasen.,Tôi phải làm bài tập.,ないで,なければ,なくても,ません
6,Thể ない,Mina bài 17,45,明日、学校へ行か＿＿いいです。,"Ashita, gakkou e ika ___ ii desu.",Ngày mai không cần đi học cũng được.,ないで,なければ,なくても,ませんでした
6,Thể ない,Mina bài 17,46,この部屋で食べ＿＿ください。,Kono heya de tabe ___ kudasai.,Xin đừng ăn trong phòng này.,ないで,なければ,なくても,ました
6,Thể ない,Mina bài 17,47,毎日、日本語を勉強し＿＿なりません。,"Mainichi, Nihongo o benkyou shi ___ narimasen.",Mỗi ngày phải học tiếng Nhật.,ないで,なければ,なくても,ません
6,Thể ない,Mina bài 17,48,名前を書か＿＿いいです。,Namae o kaka ___ ii desu.,Không cần viết tên cũng được.,ないで,なければ,なくても,ません
6,Thể ない,Mina bài 17,49,ここで泳が＿＿ください。,Koko de oyoga ___ kudasai.,Xin đừng bơi ở đây.,ないで,なければ,なくても,ませんでした
6,Thể ない,Mina bài 17,50,8時までに会社へ来＿＿なりません。,Hachi-ji made ni kaisha e ko ___ narimasen.,Phải đến công ty trước 8 giờ.,ないで,なければ,なくても,ません
