group_id,group_title,lesson,question_no,question_jp,romaji,meaning_vi,option_a,option_b,option_c,option_d
4,Câu đồng nghĩa,JLPT N5 20137,1,【あそこは としょかんです。】,,Chỗ kia là thư viện.,あそこは ごはんや おかしを つくる ところです。,あそこは ほんや ざっしを かりる ところです。,あそこは かみや からだを あらう ところです。,あそこは はがきや きってを かう ところです。
4,Câu đồng nghĩa,JLPT N5 20137,2,【まいばん テレビで ニュースを みます。】,,Mỗi tối xem tin tức trên TV.,まいにち ゆうがた テレビで ニュースを みます。,まいにち あさ テレビで ニュースを みます。,まいにち ひる テレビで ニュースを みます。,まいにち よる テレビで ニュースを みます。
4,Câu đồng nghĩa,JLPT N5 20137,3,【おとうとは あの レストランで はたらいて います。】,,Em trai tôi đang làm việc ở nhà hàng kia.,おとうとは あの レストランで やすんで います。,おとうとは あの レストランで しょくじを して います。,おとうとは あの レストランで しごとを して います。,おとうとは あの レストランで まって います。
4,Câu đồng nghĩa,JLPT N5 20137,4,【あの みせは しずかじゃ ありませんでした。】,,Cửa hàng đó đã không yên tĩnh.,あの みせは せまかったです。,あの みせは くらかったです。,あの みせは きたなかったです。,あの みせは うるさかったです。
4,Câu đồng nghĩa,JLPT N5 20137,5,【じゅぎょうで むずかしい かんじを ならいました。】,,Tôi đã học chữ Hán khó trong giờ học.,じゅぎょうで むずかしい かんじを みせました。,じゅぎょうで むずかしい かんじを おしえました。,じゅぎょうで むずかしい かんじを まちがえました。,じゅぎょうで むずかしい かんじを べんきょうしました。
