group_id,group_title,lesson,question_no,question_jp,romaji,meaning_vi,option_a,option_b,option_c,option_d
2,Sắp xếp câu,JLPT N5 20107 Grammar,1,（店で） 田中「すみません。くだもの＿＿ ＿＿ ★ ＿＿か。」 店の人「こちらです。」,,Trái cây ở đâu ạ?,どこ,あります,は,に
2,Sắp xếp câu,JLPT N5 20107 Grammar,2,A「山下さんは？」 B「となりの へやで＿＿ ＿＿ ★ ＿＿して います。」,,Đang luyện tập guitar ở phòng bên cạnh.,れんしゅう,の,ギター,を
2,Sắp xếp câu,JLPT N5 20107 Grammar,3,A「会社＿＿ ＿＿ ★ ＿＿行って いますか。」 B「わたしは あるいて 行って います。」,,Bạn đi đến công ty bằng gì?,で,は,へ,何
2,Sắp xếp câu,JLPT N5 20107 Grammar,4,山田「ジョンさん、しゅくだいは ぜんぶ おわりましたか。」 ジョン「いいえ、まだです。ここ＿＿ ＿＿ ★ ＿＿、さいごの もんだいが むずかしいです。」,,"Đến đây thì dễ, nhưng câu cuối khó.",は,かんたんでした,が,まで
2,Sắp xếp câu,JLPT N5 20107 Grammar,5,（本屋で） ヤン「わたしは この本を 買います。アンナさんは どんな 本が いいですか。」 アンナ「わたしは もう少し＿＿ ＿＿ ★ ＿＿が いいです。」,,Tôi muốn quyển sách tiếng Nhật dễ hơn một chút.,本,かんたんな,が,日本語
