group_id,group_title,lesson,question_no,question_jp,romaji,meaning_vi,option_a,option_b,option_c,option_d
3,Hiragana → Kanji,Kanji N5 bài 11,1,おおきい là Kanji nào?,ookii,おおきい là Kanji nào?,大きい,小さい,高い,安い
3,Hiragana → Kanji,Kanji N5 bài 11,2,ちいさい là Kanji nào?,chiisai,ちいさい là Kanji nào?,新しい,古い,小さい,気
3,Hiragana → Kanji,Kanji N5 bài 11,3,たかい là Kanji nào?,takai,たかい là Kanji nào?,高い,安い,大きい,古い
3,Hiragana → Kanji,Kanji N5 bài 11,4,やすい là Kanji nào?,yasui,やすい là Kanji nào?,高い,安い,新しい,元気
3,Hiragana → Kanji,Kanji N5 bài 11,5,あたらしい là Kanji nào?,atarashii,あたらしい là Kanji nào?,古い,新しい,小さい,大きい
3,Hiragana → Kanji,Kanji N5 bài 11,6,ふるい là Kanji nào?,furui,ふるい là Kanji nào?,古い,新しい,安い,高い
3,Hiragana → Kanji,Kanji N5 bài 11,7,げんき là Kanji nào?,genki,げんき là Kanji nào?,元気,気持ち,大学,小学校
3,Hiragana → Kanji,Kanji N5 bài 11,8,きもち viết bằng Kanji nào?,kimochi,きもち viết bằng Kanji nào?,元気,気持ち,高い,安い
