group_id,group_title,lesson,question_no,question_jp,romaji,meaning_vi,option_a,option_b,option_c,option_d
1403,Hiragana → Kanji,Bài 14,1,うま,uma,うま là Kanji nào?,馬,駅,店,銀
1403,Hiragana → Kanji,Bài 14,2,えき,eki,えき là Kanji nào?,社,駅,校,院
1403,Hiragana → Kanji,Bài 14,3,かいしゃ,kaisha,かいしゃ viết bằng Kanji nào?,会社,学校,病院,銀行
1403,Hiragana → Kanji,Bài 14,4,がっこう,gakkou,がっこう viết bằng Kanji nào?,店員,社会,学校,病気
1403,Hiragana → Kanji,Bài 14,5,みせ,mise,みせ là Kanji nào?,店,銀,病,院
1403,Hiragana → Kanji,Bài 14,6,ぎんこう,ginkou,ぎんこう viết bằng Kanji nào?,病院,銀行,学校,会社
1403,Hiragana → Kanji,Bài 14,7,びょうき,byouki,びょうki viết bằng Kanji nào?,病気,病院,入院,社会
1403,Hiragana → Kanji,Bài 14,8,びょういん,byouin,びょういん viết bằng Kanji nào?,銀行,病院,学校,会社
